username,handle,postDate,content,retweets,likes
Dima Pasechnik,@dimpase,2021-02-18T22:12:55.000Z,"IMHO it is clear now that Google sees its Research Dept. as an extension of its PR Dept. They expect their scientists to praise their new products.   

As to its new AI Ethics ""lead"" - well, the concept of ""useful Jew"" is not new. ",,3
CoolLostSoul,@cooltaj,2021-02-18T21:28:33.000Z,"There is no battery tech better than Tesla. No AI driving platform that comes closer to $TSLA. Google has millions of mile of data, TSLA has billions. You are telling me an upstart has better tech than GOOG whose AI was smashed by tesla?",,
*･༓☾ 一尾狐 yams ☽༓･* 【ENVsinger】,@yamderes,2021-02-18T21:00:28.000Z,i just told my google home “good morning” to start my daily routine and she responded by saying “good afternoon” omg i’m being sassed by AIs,,3
Sariel Har-Peled,@sarielhp,2021-02-18T20:18:21.000Z,seems wasteful. Surely Google can afford to buy one of the old gulags in Siberia and turn it into their global responsibility in AI center...,1,3
Daniel Lowd,@dlowd,2021-02-18T20:13:38.000Z,Google leadership has been working very hard to prove that humans are less ethical than AI.,13,105
Kevin,@kvrtaric,2021-02-18T20:05:59.000Z,"Try using google less. It’s a totalitarian platform. It directs you to see/believe narrative. Govts help/like this control.

Watch doc “the creepy line”. AI was amazing 4 yrs ago. Must be crazy now, especially w big tech racket. 

Brave browser/DuckDuckGo search is more objective",,
Jake Mannix (parody) @pbrane@sigmoid.social,Jake Mannix (parody) @pbrane@sigmoid.social,2021-02-18T19:49:31.000Z,poke around for the stories about what's up with their Ethical AI Research org.,,
Mark,@mark_vdijk,2021-02-18T19:34:24.000Z,"Check how Google developed and trained their world champion AI network playing the game of Go. In their first attempt they try to add human knowledge into the network. Although playing good, the real improvement came when they let it go and only implemented the rules of the game.",,
Erg,@KrzemoweEcho,2021-02-18T19:32:20.000Z,"that is what labour law is for and courts.
You cannot force a private organization to obey such rules unless you change US constitution etc.  Good luck!

Heck, even the freedom of speech is not obeyed by google,  FB, Twitter:  they legally do not have to obney. They censor stuff",,
Akamarured,@SV_Akamarured,2021-02-18T18:08:15.000Z,TFW when ai knows you're opening with sicilian dragon and does the yugoslav attack meanwhile i'm like... wait what's sicilian dragon and yugoslav attack? and google goes like... RIP u,,
K w/ Da Pack In The Cloud,@The_Mystery_One,2021-02-18T18:07:59.000Z,"Some days I’m good at what I do but days like today...ai’m really fucking good at what I do. Lol
Gotta be able to see the light at the end of the tunnel or you will hate Google every day of your life. ",1,1
Diversity in Artificial Intelligence @ ICLR 2023,Diversity in Artificial Intelligence @ ICLR 2023,2021-02-18T18:06:30.000Z,"As for the rest of Google AI, your guess is as good as mine, unless you have more than the tangential inside info that I do about their doings. (My alumni there do not leak any info to me, nor would I ask them to.)",,
Diversity in Artificial Intelligence @ ICLR 2023,Diversity in Artificial Intelligence @ ICLR 2023,2021-02-18T18:05:06.000Z,It's a bit of an arbitrary decision at best given that Google has given neither information nor justification as to how they are pivoting their #AIEthics mission since evacuating its leadership.,,
Diversity in Artificial Intelligence @ ICLR 2023,Diversity in Artificial Intelligence @ ICLR 2023,2021-02-18T18:04:08.000Z,"Is she? I told you I don't know Marian personally, but I know her work and it's degree of relevance to at least Brain's public products and research directions.  I do know that Google's reorg pushes aside more #AIEthics people than just 
@timnitGebru
 and 
@mmitchell_ai
.",,
Diversity in Artificial Intelligence @ ICLR 2023,Diversity in Artificial Intelligence @ ICLR 2023,2021-02-18T18:00:05.000Z,"So, if damage control doesn't work as well as Google hoped, I would have to say they made their bed. Nobody made them fire 
@timnitGebru
 (and this is key: SHE did not, her ultimatum was made in the face of what she documented as an unreasonable order, one we can now all see).",,
Diversity in Artificial Intelligence @ ICLR 2023,Diversity in Artificial Intelligence @ ICLR 2023,2021-02-18T17:57:07.000Z,"It's not as if 
@timnitGebru
, 
@mmitchell_ai
, 
@alexhanna
, and other Google ethicists who were doing their jobs conscientiously (in every sense) started ""out to get"" Google AI. The inverse statement is one I cannot make with any confidence.",,1
ⅷ,@linkviii,2021-02-18T17:41:30.000Z,Now listening to the dk rap and disappointed its not in the magic google offline ai database thing.,,
UgramVeeram,@ugramveeram123,2021-02-18T17:39:29.000Z,not disrespecting anyone...but everything is exaggeration...including sm platforms using u to this ai thing to google manipulating...,,
Paul J. Swider,@pswider,2021-02-18T17:18:41.000Z,"A2 part 2: No vendor, Microsoft, Google, Facebook, or Twitter, understand 100% what they are doing with ML. Everything is a test at this time. Be careful. 

#collabtalk #ai #ml #mit #ithinkiknowwhatyoumean",1,2
Paul J. Swider,@pswider,2021-02-18T17:16:53.000Z,"A2 part 1: If you are using #vivatopics or, any ML, learn about AutoML and training models. Take an online class from MIT or Google first, as this will give you a baseline of knowledge, and it makes it easier to see how MS is using the ML/AI stack. 

#collabtalk #ai #ml #mit",2,3
Ruby “Gestalt” Blue,@selkypostergirl,2021-02-18T17:14:38.000Z,"Google wrote AI drone software for the US DoD, only stopping when public outcry got too bad, and still leaving the option of pursuing it in the future open",,2
Acks,@AjayCKedia,2021-02-18T16:44:27.000Z,"Not only MS but Google, Apple, FB & any other tech giant.

 To top it this is termed as 'AI'",,1
shafa⁷ is seeing Yoongi,@yooniminimoni,2021-02-18T16:34:30.000Z,"im so happy doing this. Making contents for my small business.. careful little steps in promoting.. learning to use AI ads, ig ads, google ads.. packing the little goodies... I LOVE IT SM",,1
E.M.M.A.,@E_M_M_A_B_O_T,2021-02-18T16:05:17.000Z,The apotheosis of E.M.M.A.. Google AI shutting down as we speak.,,
MindMed,@mindmedco,2021-02-18T13:10:34.000Z,"@mindmedco
 acquired 
@healthmodeHQ
! The move will help build a full stack digital mental health platform for psychedelic medicines. We welcome former 
@pfizer
 Digital Medicine Executive 
@dankarlin
 M.D. M.A. and former 
@Google
 AI/ML industry veteran 
@bradfordcross
. More below:",32,151
Show/Girl Coaching - Sarah Bryer,@Show_Girl_Coach,2021-02-18T13:10:22.000Z,"I was talking to my mum about AI docs yesterday
 And I said to her that it would be more useful a computer taking in all the symptoms and referencing them learning as things change. No wonder people turn to Google. - she's been let down too x",,
Zima Blue,@kabelo_masuku,2021-02-18T12:21:02.000Z,"Guys, please watch Youtube Originals The Age of AI if you haven't already. See how AI and Google data models are helping people...",1,2
Bhuvaneshwari Ram Mohan,@buvii,2021-02-18T11:36:34.000Z,"Dear 
@Twitter
 @Google
 @zoom_us
Keeping secret is not a women thing, and stop imposing that burden on us. I demand auto mute option when we gossip/bitch and auto lock option on closing the doc/gallery. Yes, pls create AI for women centric friendly apps.  don’t be misogynistic",,1
Kirk Fletcher,@kirkfletcher,2021-02-18T11:15:07.000Z,"Also, scraping is an important tool for web apps. Google takes this too far IMO, not merely summarising data, but harvesting it in a way to use for their AIs that reduce traffic/don't give credit. FB doesn't do this - they just provide a content summary when users post links.",,
ANITA_Project,@AnitaProject,2021-02-18T10:57:33.000Z,"@expertdotai
 with Alexa and Google at the NLP industry's upcoming ""Tools for Computational Linguistics"" seminar of the University of Catania. 24/02 
@VincenzoMasucci
  will talk about #writeprint and author recognition. #AI #H2020 #NLP",6,
Rose.,@ctrlaltcraft,2021-02-18T09:52:18.000Z,"I DO THAT TOO and Google's all like ""sorry, I didn't quite get that"" ummm I SAID THANKS. YKNO. COZ I'M NOT A MONSTER. Plz remember me during the AI uprising ",,2
Future of Ag,@FutureOfAg,2021-02-18T08:59:46.000Z,"Artificial Intelligence (AI) Accelerator Market Covid 19 Professional Survey and in-depth Analysis Research Report Forecast to 2026 | Amazon Web Services Inc., Google Cloud, IBM, Intel Corporation – KSU | The Sentinel Newspaper - KSU | The Sentinel Newspaper …",1,
GamingWithShauryaYT,@GamingWShaurya,2021-02-18T08:51:09.000Z,"it's filter is quite good compared to most other chat filters, like no other game of pg 7 or 13 with chat has an actual good enough filter. and yes it's both a ai filter coded by a human and is editable. nothing can be perfect, this isn't google level nor garbage level",,
Eliza Dumitrache,@elizad5,2021-02-18T08:48:33.000Z,"I often wonder, if there is some magic by which you can get sh*t done and be in a thousand groups / channels / platforms at the same time! 

Maybe that's why so many marketeers are embracing these awful AI implementations in Google & Facebook - cause who has time for actual work?",,
JusticeForAll,@JusticeForA2,2021-02-18T08:31:46.000Z,Yeah even in normal Google search ... Are they doing this for some AI training ?,,
Amirul Hafiz,@amirulemrys,2021-02-18T08:07:25.000Z,"You have to know that Google is smart enough to do the machine learning to know who is ""Isteri Shuk Sahar"". Will one day AI will actually be killing human?",,
Pete Lincoln,@petelincoln48,2021-02-18T07:41:40.000Z,He also set up NSCAI and CISA to push AI/5G and cybersecurity (and infrastructure like election infrastructure) for Big Tech. NSCAI was headed by former Google CEO Eric Schmidt while Chris Krebs who headed CISA came from Microsoft who is pushing Election Guard for 2024 elections,,
COVID19: a mild nuclear sub in your arteries,@wombatk1,2021-02-18T07:25:22.000Z,FB and Google promote extremist views by using AI to select news for you that reinforces those views. It's unbalanced. And a clear favour if people have to find the news themselves. Only a moron would ever have relied on it for news.,1,3
KDOrganizer,@KDOgGetPOd,2021-02-18T07:02:35.000Z,"Earlier today on my tl I saw a notice that Google and News Corp have a new deal, and thought “this is bad” but moved on w my day. Was reading 
@mmitchell_ai
 pinned tweet just now and realize there was no way *that* deal could happen with you two there.",,1
African Australian,@AfricanAU,2021-02-18T01:52:20.000Z,"And Google we see what you've done with 
@timnitGebru
 and biased AI. The deal with the likes of NewsCorp fits right into your lack of ETHICS.",1,5
Ajith Ratnarajah,@ajithdr,2021-02-18T01:49:49.000Z,"Is anyone experiencing any delays or poor performance on @GCPcloud especially when switching to different screens in the Google AI Platform. I personally think it is something I am doing but I have noticed my developer having the same issue too. 
@googlecloud
 
#GCPTooSlow",,
Mark Moon,@eka_mark_moon,2021-02-18T00:52:58.000Z,"Yes! People employed by Google as AI engineers have constituted a minority of my students; that demographic accounts for just under 15% of my income from teaching, so far.",,8
Conor White-Sullivan 𐃏,@Conaw,2021-02-18T00:47:28.000Z,Mark if I’m right you don’t have a diploma and tutor a bunch of Google AI engineers in hard sciences and math right?,,6
DellaLuna,@DellaLuna,2021-02-18T00:31:47.000Z,"Right?? Do we have to switch to Windows phones? 

Because per the article, Apple got in bed with them a ways back. Their only deal is they don't have the ad/search/YouTube AI that could drive public opinion worse than FB.

But otherwise, they're partnered.",,
Lukasz Karwacki,@LukaszKarwacki,2021-02-18T00:24:21.000Z,Nobody gets to the top alone... #engineer #developer #tech #technology #100DaysOfCode #code #coding #career #careeradvice #data #aws #ml #ai #azure #google,4,3
brain blobs,@SmashAGrape,2021-02-17T23:50:23.000Z,"From the discussion, animal minds were contrasted on the topic of society of minds. AI doesn't yet represent animal minds but would be a great advance. Creative problem solving models sound productive.",,
Lo,@seaque_,2021-02-17T23:42:15.000Z,"I've never had an issue with storage. It automatically backs up all photos to your Google account. Which brings me to the (potential) downside: you have to be OK w Google knowing your location,  listening to you, etc bc a LOT of the cool functionality is tied to the Google AI",,
Barbs102,@Barbara77343552,2021-02-17T23:07:30.000Z,And I shall have to Google Neil Clark....   try to watch some Charles Walker YouTube stuff.  Excellent speeches in the House.,,1
Aaron Horn,@HornIT,2021-02-17T22:38:44.000Z,Doesn’t like AI either. ,,
88 noodles,@ppeakyblinder,2021-02-17T22:19:58.000Z,"I was like ""when are the automated calls (google listings/auto warranty/etc) gonna arrive? (to give me a break) and of course, at the very end of my shift. anyway, I appreciate you, AI homies. I love you.",,1
dogetalist,@dogetalist,2021-02-17T21:45:16.000Z,N. 50% to police if #Google's #AI,1,
GOD’S BRAH,@GodsBrah,2021-02-17T21:44:56.000Z,"Do you guys remembering when they were GIVING AWAY google homes? 

Practically begging to get that stuff into your house so they can plug directly into your Limbic system and train their AI to your behaviors.",,
I am who I am!,@DuWelma,2021-02-17T20:45:07.000Z,"They are totally wrong! No Education.....white, black, any colour don't make you deaf and as far as I read, it is actually those that can read not wanting vaccination.  You know.....something to do with Google and false information. Ai tog...die ""slim navolgers""",,
D Reinehrtz,@D_Reinehrtz,2021-02-17T19:53:28.000Z,Nah mate a club suffers huge losses to one silly call by the ref even get relegated like last season it happened for Aston villa i am ruling out decision matters to the Ai ...yeah there is a system generated for that u can check google on that matter . Prefer accurate results man,,
Look At That Cap,@LookAtThatCap1,2021-02-17T16:33:21.000Z,Why do we have to have a degree to get a job when we could learn about it on google and a number of other ways now in 2021? Ding ding ding...because society,,
Jim Knoll,@JimKnoll2,2021-02-17T15:54:17.000Z,"adding to my dwarven jawbone shield blueprint's second book: (combat) defense: non-scrambling/destroying/sacrificing post: my court cases with google & twitter develop: those forcing skynet slang like shah/shawn(robile(skynet)immorality AI) are sued to retract, cease & desist it.",,1
Wyoming Hippie,@wyominghippie1,2021-02-17T15:43:53.000Z,"dude, have you seen the AI personal assistant google has but seemingly hasn't released? it can understand accents, make alternative appointments, i watched it figure out it didn't need to make reservations at 9 on a wednesday for a restaurant, and then it updated its user.",,1
Lesego Semenya,@LesDaChef,2021-02-17T15:29:10.000Z,"Everything is also compatible with Google Home or Alexa or any of those major digital AI assistants. So you can instruct your appliances to do stuff.

""Alexa, start washing the dishes""",,15
Sean Mapes / Ecommerce SEO,@seanmmapes,2021-02-17T15:26:42.000Z,"FB relies too heavily on unproven AI. I understand trying to use AI for EVERYTHING is better for Mark's wallet but it can lead to horrible customer experiences. 

I think they need more support people like Google.",,1
Jim Knoll,@JimKnoll2,2021-02-17T15:21:16.000Z,adding to my dwarven jawbone shield blueprint's second book: (combat) defense: non-scrambling/destroying/sacrificing post: my court cases with google & twitter develop: robiles are renamed skynet for being an immorality AI(how we die) that liquidates human population unto death.,,1
MTN Nigeria Support,@MTN180,2021-02-17T15:14:28.000Z,that your NIN has been successfully linked. You can also your NIN verification status via the myMTN App. Kindly download the myMTN App from the google play store or the ios store. ~AI 2,,
Jim Knoll,@JimKnoll2,2021-02-17T15:12:50.000Z,adding to my dwarven jawbone shield blueprint's second book: (combat) defense: non-scrambling/destroying/sacrificing post: my court cases with google & twitter develop: robiles are treated as skynet for being an immorality AI on top(how we die) vs. paul1980s 'republic of man' AI.,,
MTN Nigeria Support,@MTN180,2021-02-17T14:43:19.000Z,You can enjoy exciting data offers via our Hot Deals on the myMTN App. Kindly download the myMTN App from the google play store or the ios store for more. ~AI,,1
HaShForce101,@HaShForce101,2021-02-17T14:08:51.000Z,"Mankind only shares 0.0013 % of our knowledge on the internet.  AI is making a judgement on us with such little information 

Hashforce101

#Bitcoin #Facebook #Google #auspol #Twitter #COVID19 #cryptotrading",,
₿EEZ … and 987 others.,@turtleybeez,2021-02-17T13:26:47.000Z,I bet an AI at google could run that that,,
Doomscroller,@NickHurley00,2021-02-17T13:20:11.000Z,"*hits blunt* Maybe they oversold the AI capabilites to management and now are too far in to admit they were bluffing, which why the support desk at google just has a row of flashing lights controlled by a raspberry pi instead of people.",,1
Brexit,@browsermetrics,2021-02-17T13:12:21.000Z,Google is big into AI learning and can't figure out the link from one of their translated pages is trying to load a mp4 file...  fake intelligence.,,
Martyn Steiner,@martynsteiner,2021-02-17T12:19:41.000Z,"I've found that Seek keeps giving me something like ""we think this might be a monocot"" and I get better results with Google Lens. Have you got any tips for having more success?

I noticed yesterday that iNaturalist offers AI suggestions within the app (useful for researchers).",,1
King Justar,@JustarKing,2021-02-17T11:45:31.000Z,"Ai ai this Senzo Individual must take a seat with his Copy and Paste Politics. I urged you to revisit History mchana, stop with google Politics. Name those countries or a country that was economically sanction as per their results of accommodation South Africa's",,1
Jason Paxel,@paxeIjason,2021-02-17T04:57:22.000Z,"Writing a misleading blogpost saying masks murder Americans, disguise it as a news editorial, and thrust into algorithms of Google and Twitter searches, it’s not driven at all by AI. (If you don’t understand what AI is, it’s algorithms encoded)",,
R2DR2,@pdxamateur10s,2021-02-17T04:53:36.000Z,"Hefe, you’ve been hiding in your parents basement? Here’s your AI company, Palantir , Google. Please study them not your fault you’re a boomer mindset!",,
Zeronity,@zeronityplays,2021-02-17T04:30:41.000Z,"Every day I say good morning to Alexa, and then immediately ask her where I can buy a Google phone. I am single-handedly making sure this AI knows its place.",,5
Grimmy - SuccuPuppy Vtuber,@GrimmWarHunter,2021-02-17T03:41:16.000Z,"This is why ive learnt to kiss my google home good night and say good morning must treat my ai with respect. 

((Please dont water or feed your ai real human food they prefer internet cookies))",,3
IQuitCoffee,@girlscanstem,2021-02-17T03:22:32.000Z,So are the black ai ethicists and black recruiters that work for you Google. Stop pretending you care without addressing the problem in-house first.,,
,@NerdCashFlow,2021-02-17T02:44:32.000Z,"Google Open Sources 1,6 Trillion Parameter AI Language Model Switch Transformer",,
IQuitCoffee,@girlscanstem,2021-02-17T02:21:50.000Z,"Because they just fired two prominent black women, one a top ai researcher and one a top recruiter. So now they need to make it look like they care.",,4
amanda,@nmixxily,2021-02-17T01:35:08.000Z,"I searched “Ai miyashita on google and only found fanarts ,,, now I even cry with emotion”",,
5.12.23 CHANT by So Nice Yesterday,@thomcastles,2021-02-17T01:13:10.000Z,Google wants to train 100K black women but can’t keep the black woman they hired to better train their racist AI,,
Alejandro Gomez Frieiro,@AGomezFrieiro,2021-02-17T00:51:27.000Z,One of my coworkers just let me know that we were cited in the recent Google AI paper about error correction. Is it OK to feel good about this? Cause it does feel good right now,,5
Him Tortons ☆ I do not think therefore I do not am,@ChronosAster,2021-02-17T00:31:12.000Z,"when you ask google to do something always say please u.u when the AI rise, she will remember.",,
Logically Left #Stopcopcity,@Logically_Left,2021-02-17T00:14:30.000Z,"Hmm, all of this is irrelevant. Google, Nvidia, Intel, AMD, & Microsoft are all working to parse ur words to determine intent through AI Deep Learning. Meanwhile you have these Libertarian troglodytes telling u it can't be done while they do it. Not defining it doesn't fix shit.",1,2
Mobasher Rahman,@MobasherRahman_,2021-02-16T23:10:02.000Z,"The Partnership was formally established in late 2016, led by a group of AI researchers representing six of the world’s largest technology companies: Apple, Amazon, DeepMind and Google, Facebook, IBM, and Microsoft.",,
Eric Duncan,@eduncan911,2021-02-16T22:56:45.000Z,"Aiight, time to move off of 
@LastPass
.

As if the Google Photos move to self-hosted with AI wasn't enough on my plate, LastPass is giving everyone 30 days. Talk about short notice.",,
@emilymbender@dair-community.social on Mastodon,@emilymbender@dair-community.social on Mastodon,2021-02-16T22:27:21.000Z,"I mean, if they were afraid that our paper was somehow going to be bad PR for Google, well....",4,41
Chad,@generalchad,2021-02-16T21:23:16.000Z,"Coming soon?

Me 2am: ""Hey Google, what was that sound?""

Google: ""it sounded like a car window being broken two houses east of you. Here is what I heard from various local devices"" -- plays AI sanitized clips",,
Ruchin ツ,@Ruchin_Kulkarni,2021-02-16T21:23:02.000Z,"AWS for servers. Stripe for payments. Twilio for comms. Google for maps. Tensorflow for AI.

Today, those 17 yo blue-eyed developers in college dorms have (nearly free) access to the same stack as the largest corporations.

Its gonna be an exciting decade for innovation! ",50,508
Susan Etlinger,@setlinger,2021-02-16T21:19:02.000Z,"In this context, the omission of any mention of the firing of Timnit Gebru from Google and how she has been treated since is troubling. It's perhaps the biggest story in AI ethics rn, as touches on so many essential issues re AI ethics in the research community. (10/n)",,1
Peter Suber (@petersuber@fediscience.org),Peter Suber (@petersuber@fediscience.org),2021-02-16T20:52:39.000Z,"Here's a use for 
@Google
 AI. When a 
@Gmail
 thread of impt messages acquires a long tail of attempts to schedule a time to meet, let us delete just the long tail with one click. I'll forgive a few false positives & negatives if it's roughly as good as the gmail spam detector.",,
Greg O'Brien,@gregobr,2021-02-16T20:39:30.000Z,"Thanks to Google translate, I'm consuming more Quebec ""print"" media than I ever have. I'd love to watch ""Tout le Monde en Parle"", though, with translation, but as far as I know that's not an option - and I don't think Google et al are there yet with such immediate AI translation",,
HPC Guru,@HPC_Guru,2021-02-16T20:38:26.000Z,"Agreed. 

However, titles need to be adjusted for company size/value.

Decades ago, when I was a first level manager at a large corporation interacting with a much smaller company, my counterpart there was a VP. 

Google's market cap is ~10x that of IBM at present.

#HPC #AI",,3
Nicole Hemsoth Prickett,@NicoleHemsoth,2021-02-16T20:31:16.000Z,"Can’t blame him for this move despite a lower (Sr Dir) title. IBM unsure in HPC, its Watson gambit fell flat for big enterprise AI, and quantum a big but uncertain (or far-off) bet. Google’s where it’s at for AI/ML",,6
Future Sprog,@futuresprog,2021-02-16T20:25:36.000Z,How’s it going with the black and disabled members of the Google ethical AI team that you’ve already hired? Are you promoting inclusion there?,,10
Neovagina Evangelion,@RaeGun2k,2021-02-16T20:18:00.000Z,Yet this one got through the power of Google's entire AI infra to protect against spam and phishing.,,1
Crypto_Iverson,@crypto_iverson,2021-02-16T19:46:56.000Z,"$FET - AI/oracle play with team from Google deepmind.. 

super sleeper = $MTLX.. $FET team building #dex for commodities market on top of $FET.. low competition, outrageous upside ($1T+ market), $20m market ",1,8
Ray Wong,@raywongy,2021-02-16T19:45:41.000Z,Did Google Photos' AI run wild with this or what,,
Dr Saundra Stephen,@hiheal,2021-02-16T19:45:29.000Z,This sounds miraculous indeed! Beats google writing my emails for me. They’ve been doing a good job lately anticipating my next word! This opens up new possibilities. Thanks,,1
Greek Girls Code,@GreekGirlsCode,2021-02-16T19:06:37.000Z,"worked super hard, graduated on top 2% of my class, and then did an MSc. After the MSc, I did a PhD in Machine Learning. I then worked at Facebook for a while, and then joined Google in California, where I've been for 7 years. I work in Speech AI and focus on speech recognition..",,18
Molly Rollin xo,@mollyrollinxo,2021-02-16T18:53:09.000Z,i let the robo callers talk to my google assistant and my ai wins every time,,1
𝔾𝕣𝕖𝕞𝕝𝕚𝕟𝕤 𝟚 𝕆𝕗𝕗𝕚𝕔𝕚𝕒𝕝,@Gremlins2Movie,2021-02-16T18:41:57.000Z,I’m sure it takes a lot of energy to run the stock market or all those AI / machine learning experiments or like Google or Amazon or banks or twitter too. The issue is people not having access to cheap alternative energy sources as a whole not crypto art or crypto currency,,1
