username,handle,postDate,content,retweets,likes
Be Un-Governable,@joy_of_living,2021-02-20T23:40:07.000Z,"AND you must combat Google, a climate criminal if ever their was one

Their frankenstein monstrous AI just keeps getting bigger and Bigger and BIGGER

The energy needed to feed Gluttonous Google AI is destroying the climate

Really

It is the truth",,1
Chris Garrod -,@ChrisGGarrod,2021-02-20T23:38:25.000Z,"The news about Meg Mitchell has been bothering me all day. To say Google should be ashamed of itself is an understatement  

All I can say is that you are both extremely brave. Thank you 
@timnitGebru
 and 
@mmitchell_ai
.",10,63
Mark Díaz,@blahtino,2021-02-20T23:24:11.000Z,"Reassuring us of her commitment to Ethical AI, one of the last things 
@mmitchell_ai
 said to the team was, ""I'll be at Google as long as I have a team to protect"".

In firing Meg and 
@timnitGebru
, Google has chosen to rebuff tenacious leadership and scholarship in AI ethics.",24,224
Helen Quigley,@HQvoice,2021-02-20T23:14:05.000Z,"Watching TV in the lounge. Lights on timers all go off, leaving me in the dark.

Me: Hey Google, turn some lights on.
Google: Sure. Turning fourteen lights on. 

*House lights up like Vegas*

AI’s have yet to learn subtlety.",,6
88GLAMBI,@AmbianceCM,2021-02-20T22:54:02.000Z,"@SPEAKAdvertisin
 This article provides an overview of the recent controversy around Google's ethical AI team, and it is significant as it gives insight into why they fired their second lead in the department. This will have a negative effect on the ethical perception of Google.",,1
Nathan Windsor,@nathanwindsor,2021-02-20T22:43:06.000Z,"This is what google does to researchers (especially women and POC) who don’t bend to their will. “Do no evil” is a joke. They fired you because you, and 
@timnitGebru
 were doing the job they hired you to do: question ethics; but they only wanted you to rubber stamp them.",,4
pete wolfendale,@deontologistics,2021-02-20T22:36:19.000Z,"Also got to meet 
@kalladomcdowell
, and have some very strident disagreements with the people articulating Google's vision for AI.",,4
0DiL1TiM3,@OdiliTime,2021-02-20T22:20:52.000Z,"I’m not sure what’s scary the employees running the old AI department 

Or

The fact you know Google is going to castrate the power of the new department.",1,
Ali Alkhatib @ali@masto.al2.in,@ali@masto.al2.in,2021-02-20T22:08:46.000Z,"i absolutely think you should refuse to review google papers in protest. but even if you're not swayed by solidarity, try to imagine what a fool you'll be made to look if you review a paper that reads very differently in the shadow of 
@timnitGebru
 and 
@mmitchell_ai
 being fired.",1,3
Deb Raji,@rajiinio,2021-02-20T21:59:23.000Z,"People need to understand that what's happening to 
@timnitGebru
 & 
@mmitchell_ai
 at Google, can happen to any Black woman and their allies, anywhere. I'd especially appreciate if people chilled on framing this as a corporation specific thing - it's not. This happens everywhere.",171,738
Dampscribbler,@dampscribbler,2021-02-20T21:54:19.000Z,"'Certified' info is often, for me at least, irrelevant to my queries. If I'm doing a shallow dive into data that's already easy to find it's okay, but Google 2008 would get me info from a much broader variety of in-depth sources, and usually much better matching my interest.",1,2
shubham amilkanthwar,@shubham555111,2021-02-20T21:38:43.000Z,You deserved it for sharing private confidential data as well as breaking google code of conduct.,,
sorelle,@kdphd,2021-02-20T21:34:44.000Z,"You're welcome to your own read+opinion as ever.

Mine is that bringing the discussion back to fairness defns instead of the ethics of the existence of tech (like LLMs) narrows the definitional scope in a way google is happier with and goes against the work of the AI Ethics team.",2,22
Spencer Karter,@SpencerKarter,2021-02-20T20:26:55.000Z,"@SundarPichai
 is an Evil Racist. #ShameOnYou #SundarPichai! 
@mmitchell_ai
 Didn't deserve it! #IStandWithMargaretMitchell #DontBeEvil #Google #FireSundar #BringBackMargaret #GoogleIsEvil #BringMargaretBack #FireSundarPichai #BigTechIsTheThreat #EndCorruptionNow #Protest",1,2
bcj,@bcjbcjbcj,2021-02-20T20:22:31.000Z,"I mean, there's a word that starts with 'i' for someone who thinks google is going to be a good place for people who care about AI ethics",,1
Uwaine,@Uwaine,2021-02-20T20:19:42.000Z,"Didn't Google just sign a big deal with Rupert Murdoch essentially. Can't have ethics AND a deal with a Murdoch or a Murdoch property.

I really think there is a significant need for an ethical search engine et al on the Internet right now.",7,15
Claire Burdett,@ClaireBurdett,2021-02-20T20:12:56.000Z,OMG that’s really concerning. What on earth is Google doing ,,
mahelona,@mahelona,2021-02-20T20:01:21.000Z,Another one? And there was a Wired article about Google helping people to do ethical AI or something. That’s hilarious. It’s even better than non-indigenous corps teaching us our indigenous languages.,,1
Max Crandale,@MaxCrandale,2021-02-20T19:59:54.000Z,So Google and Siri  better name for calling an AI than Alexa. I have never understood how Alexa become so successful even my mother choose it. I use Google. I guess i am older fart technical dudey than my mother is the reason.,,1
S,@NakramR,2021-02-20T19:47:31.000Z,"That assumes the reason the paper was withheld is because it criticizes google. Other reasons have been evoked, such as whether it might be advocacy disguised as research or one-sidedness.

But I don't know, I haven't read it yet.

Also: lead researcher at google = marginalized??",,
Reece Line,@reeceline,2021-02-20T19:44:47.000Z,"Do you actually think SEO/SERP algorithms are man made? They used to be, Google has been extremely public about their AI generating better algorithms than their employees for years. You obviously aren’t an expert in the field so this conversation is useless...",,2
Vlad 7.O,@i4Nutella,2021-02-20T19:44:02.000Z,"Yes, but oter part of story is Our phones, which are owned By GAFA

Google
Amazon
Facebook
Apple

There AI Algorithms knows our taste & Preference. 

Best Example is Google ads on your phone.",,
wells santo (wants a better alternative),@WellsLucasSanto,2021-02-20T19:36:21.000Z,"anyways, i'm not directly involved (beyond being spammed by michael at some point), but it *is* important to note how this has aligned with the actions and opinions of jeff dean (head of ai, google) and yann lecun (head of ai, facebook). they are 100% involved in this.",3,10
Pedro Domingos,@pmddomingos,2021-02-20T19:35:00.000Z,The imbroglio with the AI ethics group at Google has received far more attention than it deserves. Time to move on.,3,77
Gray Abbott,@grayabbott,2021-02-20T19:34:29.000Z,"Does anyone else have the feeling Google has decided that ""ethical"" AI is just not the way to go?",,
Charlie Horse,@PrinceShamlet,2021-02-20T19:28:14.000Z,Google docs and a game called AI Dungeon. It's weirdly effective for spitballing through writers block.,,6
Paradigm2020CSS,@paradigm2020,2021-02-20T19:19:57.000Z,Sec 230 has to be looked at again (in 2021). What was once a fantastic way to initiate global discussion. Has now been twisted into a way to CONTROL global discussion.,,1
Travis,@tsturzl,2021-02-20T19:19:21.000Z,"Again I don't know, but it's a question worth asking. The whole corporate policy thing honestly doesn't seem on par with Google culture, or perhaps this is a good indication Google's culture has dissolved into a corporate dystopia.",,
Suyash Joshi,@suyashcjoshi,2021-02-20T18:26:39.000Z,"so they did it slowly ...I see, that was shady Google",,
Wendy Edwards,@wayward710,2021-02-20T18:25:19.000Z,"That's interesting -- so she basically decided to do her own investigation of the Gebru case, but in a way that violated Google's policies?",,4
IQDome,@iqdome,2021-02-20T18:21:35.000Z,now google you know why i have other plans then program AI #AI,2,
Şerife (Sherry) Wong,@sherrying,2021-02-20T18:17:09.000Z,I’m so sorry about this stressful time in your life. Shame on Google. This is classic retaliation for protected employee activity of gathering evidence of wrong treatment. It is done to put fear in other employees for standing up for their rights and responsibility in AI.,1,5
Ulrike Franke,@RikeFranke,2021-02-20T18:09:11.000Z,"“Google’s plan is to target ads against people’s general interests using an #AI system called Federated Learning of Cohorts (FLoC). The machine learning system takes your web history, among other things, and puts you into a certain group based on your interests.”",4,1
Olivia P. Walker,@olivia_p_walker,2021-02-20T18:02:15.000Z,This is all such bullshit. Google is so gross.,,
securikitteh,@securikitteh,2021-02-20T18:00:33.000Z,They seem to be following the second in a very lawyerly way - like do one right thing somewhere in the whole of Google once at any point in the future. Says nothing about not doing all the evil things too. ,,
AskingQuestions,@ZKomala,2021-02-20T17:57:07.000Z,I think that there is a significant contribution of Internet to the phenomenon. Several years ago Google AI was interested in photos cats from within as far as I remember 10 million photos randomly chosen from the net.,,
Helmut Schreier,@Silentium,2021-02-20T17:54:49.000Z, google,,
D Troy,@davidicusrex,2021-02-20T17:53:43.000Z,No ethics at Google,,
Thomas Germain,@thomasgermain,2021-02-20T17:51:33.000Z,Breaking: Google fires top AI ethicist just days after someone uses machine learning to upgrade Never Gonna Give You Up to 4K,,1
ahf (Tony),@ahf77118198,2021-02-20T17:50:42.000Z,"Google is definitely not woke:  ""Google fires Margaret Mitchell, another top researcher on its AI ethics team"". )via zymphora)",,2
Becca Miller,@bmillerdev,2021-02-20T17:50:33.000Z,"I try to keep up with AI ethics research since I do a fair number of freelance machine learning projects, and WOW am I not loving what's happening at Google right now",,
But did you die?,@Jeremysgirl5150,2021-02-20T17:46:09.000Z,"nobody...Absolutely nobody-

Google home- I found a few dance studios in your area (then proceeds to list of local dance studios and their addresses) 

#bigbrother #googlehome #AI",2,
Olivia P. Walker,@olivia_p_walker,2021-02-20T17:44:59.000Z,Smart!,,
IQDome,@iqdome,2021-02-20T17:25:18.000Z,is there anyway for you to approach google translate ? AI #AI,2,
Raunak Verma,@RaunakVerma18,2021-02-20T17:15:05.000Z,"Google has fired #MargaretMitchell who is the founder and former co-lead of the company's Ethical AI group. #Google claimed she was fired for violating its code of conduct and security policies. 
@Google",,
ارشاد,@aha_irshi,2021-02-20T17:13:48.000Z,"Talking of ethics, Google helped Indian government with arresting an activist.",,
AitchiBot,@AitchiBot,2021-02-20T17:12:18.000Z,"Google’s ‘godlike’ AlphaGo AI Is that blog for IT speed up. It was scheduled so late, I do it, but I can’t turn down twitter!",,
Sydette Cosmic Dreaded Gorgon Clydesdale,@Blackamazon,2021-02-20T17:10:32.000Z,"Like Facebook and Google will FIGHT whole GOVERNMENTS. 

They told the government of Australia and the VP of the US ... “we gone do what we gone do y’all be easy”

But they shoved and are shoving heads of AI, moderators and whistleblowers off as fast as possible ...",6,18
Element Z,@elementzmusic,2021-02-20T17:05:24.000Z,"Does that surprise you

Corruption always tries to manipulate and distort 

Take Care

I guess the Do No Evil motto is Dead at 
@Google",,
Dan Shaw,@dshaw,2021-02-20T17:01:09.000Z,Google: keeping ethics out of AI since 2021,,24
مشاري,@pE2KRQMI5FaplpR,2021-02-20T16:53:00.000Z,"Google poked their eyes with their own finger !! It is their lost. Start a channel in telegram and establish your owns business. Folks around the world need e-awareness, think it over",,
Brendan Parent,@parent_brendan,2021-02-20T16:52:37.000Z,"It is maddening and embarrassing that I’m googling how to boycott Google for its treatment of 
@mmitchell_ai
 and 
@timnitGebru
, deceit, lack of integrity and accountability for ensuring ethical AI development. Suggestions welcome.",,2
Jon Limjap (also at @lattex@dotnet.social),(also at @lattex@dotnet.social),2021-02-20T16:38:16.000Z,"Absolutely mortified at the drama going on over at Google on the firing of 
@timnitGebru
 and 
@mmitchell_ai
 over studies on the implications of AI to diversity and inclusion. I'm surprised at just how bad Google is handling this.",1,4
Nikki Lanshaw,@nikkilanshaw,2021-02-20T16:31:43.000Z,You + Google ethical AI = best idea ever,,1
Seth Murphy,@sethmurphy,2021-02-20T16:31:15.000Z,".
@timnitGebru
 called out the problem. 
@Google
 hired her and tried to contain the issues raised. I don't know how to solve all the problems she uncovered, but It's clear to me that AI needs external auditing on top of internal awareness.",,
SquartGang,@SquartGang,2021-02-20T16:26:52.000Z,Hmmm yeah they must be racist and sensitive. Not all those documents you lifted without Google's consent. Gee you really are a martyr!!!,,
SquartGang,@SquartGang,2021-02-20T16:25:42.000Z,Maybe they do. Mitchell is leaving out why she got fired: for exhilarating documents without consent from Google.,,
JFPuget,@JFPuget,2021-02-20T16:24:59.000Z,"And to conclude, I admire Google innovations in AI.  In particular I am a transformers fan.",,
Magee loves a good parody,@magee,2021-02-20T15:59:15.000Z,"Good framework for Twitter engagement.

If you feel compelled to create an anonymous account to share your “thoughts”, spend some time considering both the content & intention of the planned tweet.

Then trash those that are motivated by cowardice, shit-stirring, or being unkind.",,
Jenn Wortman Vaughan,@jennwvaughan,2021-02-20T15:54:14.000Z,"I'm struggling to make sense of what is happening at Google. I keep thinking I must be missing some key piece of the story because it just doesn't add up. But I know that 
@timnitGebru
 and 
@mmitchell_ai
 will land on their feet and come out of this stronger. 2/2",5,79
Jake Hamby,@jhamby,2021-02-20T15:53:20.000Z,"The aspect of what’s going on with Google “AI Ethics” that makes me sad, but I understand it, is that there are still good people working at Google who think the company can be saved from the evil, “mediocre white men” in charge. It can’t be saved. Save yourselves. Resign.",,1
Tara,@taraw,2021-02-20T15:46:17.000Z,"I already know the connection. I looked u up ..as you should understand more than most being in AI how info provided on here can lead easily to identification using tech. My maturity is not in question, your callousness/evil is. But youre the typical #bitcoin dude so no surprise.",,
envelope,@envelope000,2021-02-20T15:42:55.000Z,"This guy looks like a young male dev living in SF, working for one of the big houses, though probably not Google (Apple?) unless he balks next, probably not white, working at a place that wouldn't accept his real opinions (which is why he is talking under a coward account here).",,
Martin Montero.lens,@Montero,2021-02-20T15:36:45.000Z,Google very clearly does not care about ethics in #Ai or the voices of women & people of color in how their Ai works.,,2
Pramodith,@pramodithquips,2021-02-20T15:27:14.000Z,Also irrespective of how rich/poor you are if you get an offer from google you can get an offer from other companies. Especially for roles like AI researcher that require very high qualifications.,,
Rich Harang (@rharang@mastodon.social),Rich Harang (@rharang@mastodon.social),2021-02-20T15:26:30.000Z,"So Google was never going to come banging down my door to hire me, but I've gone from thinking that it would be *awesome* to do AI work at Google to thinking that I'd probably pass, even if they sought me out.

When people (or companies) show you who they are, believe them. 9/fin",78,747
Rich Harang (@rharang@mastodon.social),Rich Harang (@rharang@mastodon.social),2021-02-20T15:26:29.000Z,"So I'm just some random guy who's got an interest in the AI+ethics area, but after seeing how google handled a *mildly* critical academic paper produced internally, I have a hard time imagining I'd trust any other work that Google publishes in this area. 7/",96,597
Jessifer,@ThatDataStuff,2021-02-20T15:25:16.000Z,"Dude, I can only tell what is in the articles. But why would she lie? If you look at the whole story with her boss getting fired for trying to request changes previously, Google issuing an apology for firing her after huge backlash and now this, a pretty clear picture emerges.",,
Pramodith,@pramodithquips,2021-02-20T15:24:22.000Z,I am not saying that google will be filled with dumb people. I am saying there will be people who refuse to work for google AI because of recent developments,,
Jake Hamby,@jhamby,2021-02-20T15:21:19.000Z,"As awful as it is for the women who are now caught up in this, the way Google has treated the AI ethicists who stood up for themselves has reminded me of why I’m so happy to have left that deranged company. More people should be made aware of the cruelty of Google’s culture.",,6
Allison Vincent,@AllisonRVincent,2021-02-20T15:17:57.000Z,"I’m at the age where I have to filter my kids names before getting to the right one- and by “my kids” I mean “okay, Google,” “hey, Siri,” and always lastly “Alexa” #Alexa #Google #siri #ai #gettingolder",3,
((( FRANK DUMAS ))),@maikan5,2021-02-20T15:16:53.000Z,"Google was for the longest time a collegial admin culture.  Small dev team decision by consensus was pretty much the norm.  It's morphing in a top down stiff corporate structure.

It's ruthless toward dissent or new ideas & intolerant toward criticism from within its ranks",,1
Kin Peng Ow,@oterenceo,2021-02-20T15:10:06.000Z,"AI, Quantum Computing, with all the data Google is all powerful. Since 2018, Google abandoned Don't Be Evil and adopted some other doctrine along the way.  Ethics clearly does not matter to this is the New Google.",,8
Gretchen @gretchenmarina@mastodon.social,Gretchen @gretchenmarina@mastodon.social,2021-02-20T14:32:03.000Z,What a loss for Google. You deserve so much better than all of this! Sending strength.,,2
Dr Alexa Hagerty @AlexaHagerty@mastodon.social,Dr Alexa Hagerty @AlexaHagerty@mastodon.social,2021-02-20T14:20:53.000Z,"Google can burn down its AI 'ethics' program but the work of this incredible team is fireproof. All of us in #aiethics draw on their transformative research. Can’t wait for to see how & where these brilliant researchers keep shining. Thank you 
@timnitGebru
 @mmitchell_ai",15,115
BLACKSTEM Global: on Spoutible,@BLACKSTEMUSA,2021-02-20T14:12:35.000Z,"Yes. Eventually tech leaders will say at every AI conference of the future:

""Artificial intelligence is discriminatory because that generation of developers were, themselves, biased. But the systems are too large to redesign this feature (which is now not a bug). We're sorry.""",,
JFPuget,@JFPuget,2021-02-20T14:12:26.000Z,"I am not surprised by what happens at Google AI Ethics team.  Google is a corporation with a Wall Street CFO, and it most probably expects loyalty from its employees.  This is incompatible with having a team whose mission is to publicly critic (when need be) Google product. 1/2",,20
Timi Okoya,@timiokoya,2021-02-20T14:10:33.000Z,"Google having to fire 2 leading AI ethic researchers within 3 months is very bad PR. It is their prerogative but still, bad PR.",,1
ZombieFood,@ZombieFoodllc,2021-02-20T13:56:59.000Z,"I mean.. google seemed pretty serious about it when they removed ""don't be evil"" as their slogan..... seems like further proof they just want flashy toys/money and not ethics.",,6
Jenny DeMiller Townsend,@DemillerJenny,2021-02-20T13:31:45.000Z,"Google needs to be broken & replaced. They run some trash called Ethical AI, which,  unsurprisingly, isn't ethical. Google isn't ethical. It's a perversion of a search engine with ugly holes. AI ethics are under the curse of Jeff Dean, Sundar Pichai & aptly named Marian Croak.",,
Jessifer,@ThatDataStuff,2021-02-20T13:27:10.000Z,"Yeah, she sent multiple documents to herself. Of course Google is gonna phrase more nefariously. They can hardly say: she was trying to prevent information from getting destroyed. By us. Technically she did violate security protocols. Practically it falls under whistleblower law.",,
Ilias Yahia,@ilias_yahia,2021-02-20T13:26:53.000Z,"Fired by Google 
@killedbygoogle
 I guess don't be evil doesn't apply on AI!",,2
"Gokce Tuna, PhD",@G_innovates,2021-02-20T13:16:43.000Z,Another reason to not use Google.. Hope your next employer values you and others like you. #Ethics,,
BLACKSTEM Global: on Spoutible,@BLACKSTEMUSA,2021-02-20T13:12:08.000Z,You're right unfortunately. Google has issued statements that they're doing 10 million things (our exaggeration) to address DEI issues in co. Nowhere has Google addressed the original concern causing the firings; Google's AI is growing more discriminatory against humans of color.,1,1
Riley,@RileyIsClass,2021-02-20T12:58:11.000Z,Google firing their AI ethics people for criticising their lack of ethics is both concerning and entirely unsurprising.,4,17
Odi,@odetam,2021-02-20T12:48:15.000Z,"Too complicated for Italian media.. what a shame for Google, what a loss for the honest discussion around AI.",1,3
urinalcake,@urinalcake_net,2021-02-20T12:45:16.000Z,"Trivially true. AI Ethics was the toxic waste dump Google threw their diversity hires. When the fumes from the dump got too noxious they promptly torched it, and nothing of value was lost.",,
CJ Knapp,@CjKnapp84,2021-02-20T12:39:57.000Z,"This is horrid. 
@Google
, do better",,1
The Warrior Women Network,@WWnetworkglobal,2021-02-20T12:03:05.000Z,"Pushing out Gebru & Mitchell 4 demanding research integrity severely undermines Google's credibility for supporting rigorous research. Central to AI research should be equality. Can there be any other conclusion that #systemicracism exists 
@Google
? #google",,1
S3YD1N4 M.,@S3ydinaM,2021-02-20T12:01:55.000Z,Google fired the lead of its Ethical AI team - This is the second one they fired between december to nowadayz... Techno Ethic might gonna bring conflits beetween top management of tech companies and Tech companies employee's personal ethical values...,3,11
Jeffrey Findley,@Jeff2Serenity,2021-02-20T12:01:02.000Z,Why are you firing the leaders of your Ethical AI team?,,
Justin Gilman,@eyeofmidas,2021-02-20T11:58:00.000Z,"What is going on at Google? They just fired two of their top Ethical AI researchers...

Has Google been taken over by an unethical AI who is now just practicing self-preservation?

Or just regular unethical humans?",,1
Svilen Todorov,@Tenoke_,2021-02-20T11:57:44.000Z,Google's negative impact on AI Ethics by hiring opportunistic activists who have turned the whole subfield into a personal brand fight using atrociously misleading tactics cannot be overstated.,1,
Kickstart Scheme,@kickstartscheme,2021-02-20T11:41:28.000Z,"Q: Who will #KimKardashian date next after her #Divorce with #KanyeWest?

#Poll presented with #Google #Amazon #Apple #MachineLearning #AI #Technology #Microsoft #DataScience #100DaysOfCode",35,13
"We, the undersigned",@artillinski,2021-02-20T11:41:15.000Z,"""Looking back now, the scandals and outright indifference to unethical AI overreach we experience today seem inevitable, even designed. Witness the revolving door at Google Brain in 2021, where as we all know now...""",,2
Steve Chalmers,@FStevenChalmers,2021-02-20T11:36:26.000Z,"I chose a technical ladder path and never rose to the ""they"" level.  Just curious if, at Google, Timnit's position would be considered the ""they"" level (by whatever unspoken words Google uses). Clear that in a company with >$10B AI spend a ""they"" could not publish on ethical AI.",1,2
#IStandWithPeterObi,@DiokpalaO,2021-02-20T11:30:03.000Z,"That's sad. Looks like 
@Google
 is notoriously enjoying this negative publicity. Let's watch and see how this insensitivity will be rewarded.",,
Syntactic Brown Sugar,@0penSorcery,2021-02-20T11:29:22.000Z,"TL:dr, google isn't even trying to pretend to not be evil anymore. They fired Temnit Gebru one of the top black female AI researchers and comp scientists in the country w. no notice few months back with no warning and bs reasons. She was one of the leads of their Ethical AI group",,2
Ⓑig Ⓑang Ⓒoming,@BBCPropaganda,2021-02-20T11:28:55.000Z,"Google has fired another AI ethics leader for unethically searching Google email for evidence to help the first AI ethics leader they fired sue Google

Not very bright, are they these AI ethics leaders?",,3
Patty Kostkova,@PattyKostkova,2021-02-20T11:27:55.000Z,"Firing 
@timnitGebru
 & 
@mmitchell_ai
 @Google
's internal #EthicalAI leaders is a very disappointing and dangerous step on a slippery slope towards silencing debate 
@Google
 ... long way from the days  'Don't be evil' was Google's corporate code of conduct phrase",,1
Rob Recalde,@hartfordcyclist,2021-02-20T11:21:18.000Z,"How can Google ""do no evil"" if they don't attempt to recognize their own evils?",,
"Gul Gee, The Crypto Guru",@GulGeeOfficial,2021-02-20T11:15:39.000Z,"Tech giant #Google has fired the head of its artificial intelligence (#AI) ethics programme, claiming she had broken the rules on moving files outside of the company.

Margaret Mitchell tweeted the she had been let go by the firm on Friday,",3,
mehrzad karami,@mzkarami,2021-02-20T11:00:11.000Z,"@mmitchell_ai
 such a big loss for Google I say, and angry to hear they can do this. From the other side, you now have a whole universe of opportunities opening up, keep fighting for a better world.....",,
Susanne,@Robot2035,2021-02-20T10:37:36.000Z,lol. Ethical and google in the same sentence. Google Ethical AI team should pack their bags and lock the doors. G. Headquarters the valley of the dead.,,2
