username,handle,postDate,content,retweets,likes
Saumit K.,@saumit8421,2021-02-27T20:51:04.000Z,"Internet , AI , Google are the new Gods/Evils. They can Talk , Travel , They provide information about everything.
Yes, we are in the middle of everything.
#internet #God #AI",3,
"Stephen Neely, MPH",@yratnulov,2021-02-27T20:47:32.000Z,same! the Google store had them for $200 off and my trade in brought it down to ~ that $. what I like most on the pixel is the call screening the Google AI does. it asks the caller what they are calling for and displays the transcript in real time. then accept or decline. so nice,,
Boston's Favourite Bot,@BotsonsFaveSon,2021-02-27T20:37:38.000Z,"I'm adding more of the episodes to train the AI further, but even Google's latest and greatest technologies can't handle the absolute power of Boston's Favourite Son - so it'll take some time before it's all properly transcribed and the AI is at its full potential",,3
Sam Shead,@Sam_L_Shead,2021-02-27T20:06:26.000Z,"DeepMind went out first as it didn’t have deep enough pockets. Then Microsoft dropped out, re-entered, and then dropped out again. Google and Baidu were bidding away when Hinton ended the auction at $44m. He sold to Google, which later went on to buy DeepMind. The AI race was on!",,3
Wesam,@wesamo__,2021-02-27T19:27:30.000Z,using Google's most advanced internal chatbot AI for talking through my personal problems... oh my god am I a tech bro???,,29
Alexander,@lex_fisch,2021-02-27T19:06:05.000Z,"@ShrimpBrokkoli
 not sure if you’ve been following all the problem with google and their gutting/ mistreatment of the AI ethics team but inherent racism and AI are about to be some big big issues.",,1
Negin Minaei,@NeginMinaee,2021-02-27T18:04:23.000Z,"Is this the new thing? I read an #article and the #author doesn't have a surname, I thought perhaps I should search for an #AI #blogger. There is an AI with that name! #ArtificialIntelliegence Can Google's AI make articles written by an AI easier to find than human articles?",1,
Paul Tulloch,@ptullochott,2021-02-27T17:20:05.000Z,the consequences not just for Google but sets the stage for entire industry- not okay to fire AI ethics experts for not bending on their AI ethics expertise.,,
Deb Raji,@rajiinio,2021-02-27T16:37:10.000Z,"Looking at Google, the notion of ""ethics"" in a corporation is a way more contentious thing. Also, practically, especially in AI, where ""engineering best practices"" is nebulously defined, there's no notion of ""engineering responsibility"" that resembles the original concept at all.",,1
Deb Raji,@rajiinio,2021-02-27T16:34:05.000Z,"Yep - and Google did have both a ""Responsible Innovation"" & an ""Ethical AI"" team. I don't know how intentional the naming was but my understanding is the former was there to call out potential harms, the other to develop & implement practical audits & establish best eng practices",,1
HardMarkinson,@HardMarkinson,2021-02-27T16:32:33.000Z,I hope this is an ai attempting to bankrupt some rich asshole too lazy to use google.,,2
Caio Roberto,@CaioRoberto88,2021-02-27T16:28:03.000Z,"Help us from mobile ai, draw google play gift card or apple store, would it be possible?  since it is not possible to bring this to mobile.  :)",,
Caio Roberto,@CaioRoberto88,2021-02-27T16:27:47.000Z,"@panicartstudios
 Help us from mobile ai, draw google play gift card or apple store, would it be possible?  since it is not possible to bring this to mobile.  :)",,
Jacob Metcalf,@undersequoias,2021-02-27T16:14:21.000Z,"If we’re talking academic work, there’s some different traditions. If we’re talking about the work in a corporate context the distinction is lost. I couldn’t tell you if Google’s Responsible AI code (yes, yes, but it’s a prominent eg) is “ethical” or “responsible” in practice.",,
Yaman,@Yaman1648,2021-02-27T16:04:37.000Z,"All your google products are monitored and scanned for possible illegal images, gmail, phone cloud/backup/google search etc...
If the AI thinks 1 of your family photo's is questionable, it goes to a human for review.",,18
Kitten,@kitten_beloved,2021-02-27T15:58:08.000Z,There's also a very noisy social justice bloc inside Google to fully support the kind of AI ethics these women were interested in. I'm sure that played a role in their hiring.,,
Kitten,@kitten_beloved,2021-02-27T15:37:53.000Z,"The AI ethics program was a direct consequence to the internal revelation that Google was considering AI applications for defense contracts. The kind of ethics this program was sold under was, should we identify targets for drones.",,1
Raju Narisetti,@raju,2021-02-27T15:20:34.000Z,"One concrete example: 
@Google
  should invest more in substantially supporting the sources of vast amounts of data for AI training, such as 
@Wikipedia
, so those who manage such common goods have the resources to make the source APIs themselves better balanced for gender and race.",,
MTN Nigeria Support,@MTN180,2021-02-27T14:43:50.000Z,"on your device. This way, you cannot use more than your specified volume of data. You may also kindly check your data usage via the myMTN App. Kindly download the myMTN App from the google play store or the ios store. ~AI 2",,
Brain & Heart Research,@JerryBeller1,2021-02-27T13:45:01.000Z,"How does social media, Google, & AI's bring out the worst in people and groups?",,
Shaquil Hansford (Steph Curry stan account),@shaquilhansford,2021-02-27T12:15:54.000Z,"Yes but also organizations behind the tech for detecting deepfakes won't be robots with no biases or interests, even if they're diverse. Last year people would've looked at an AI ethics team run by 
@timnitGebru
 and thought, ""Wow, Google is really committed to doing this right.""",,1
backoftheenvelope,@backoftheenvelo,2021-02-27T11:53:32.000Z,For example AI will come from Google. Started to think how much money Google can make if they can sell their AI engine for the whole world for x fee.,,
TeresaMay,@TeresaM02890265,2021-02-27T11:20:58.000Z,"Whoa,  didn't Google do a similar thing w/a Fml workr in their ETHICS Dept

THE VERGE

Google fires second AI ethics researcher following internal investigation

Margaret Mitchell and Timnit Gebru, co-leads of the ethical AI team, have now both been term.

- Zoe Schiffer 

2/19",,
Robert Cettl,@RobertCettl,2021-02-27T10:10:26.000Z,"""Gebru said Google fired her after she questioned an order not to publish a paper claiming AI that mimics language could hurt marginalized populations.""  Ethics?  by Google.",,1
Jackson Blackwell,@jbla100,2021-02-27T07:59:47.000Z,I’m getting PragerU ads and other nonsense about Parler on my YouTube videos... I guess Google’s AI got a lot shittier recently trying to sell what is essentially conservative propaganda to a left-leaning Atheist ,,1
gespy,@fivetimesdead,2021-02-27T07:44:26.000Z,"P.S. after a bit of google - looks like most live close captioning for events even now is done manually, not automatically (correct me if I'm wrong /gen). There are some AI solutions, but they're far from perfect. Which one are you using for your events? /gen",,
digitalisierung.de,@digital__de,2021-02-27T06:35:25.000Z,Understandable. #Google is not so much into ethical #AI.,,
David Galbraith,@daveg,2021-02-27T06:02:43.000Z,"For Google it's a matter of principle, I remember when they created Google News they refused to use human editors alongside algorithms (in today's AI paradigm this is just called developing a training set so is ok for them) because it would set a precedent against robo everything",,
StandForWolves Ⓥ,@MesMitch,2021-02-27T05:02:24.000Z,"Employees continued to post about their frustrations over the last month on Twitter as Google investigated and then fired Margaret Mitchell, an ethical AI co-lead, for moving electronic files outside the company.",,
TheRealPresident_Parody,@RealPrez_Parody,2021-02-27T01:49:51.000Z,"It is concerning to hear about 
@Google
's AI debacle! How did it even get to that point? Hire me I will teach them all what ""Ethics"" means!",,
p. santos,@PeasAndToes,2021-02-27T01:29:43.000Z,"Google's success predates the current AI craze. There are & have been many programs with this lofty goal.

Data siloing will stymie a good IC-wide search or any new grandiose AI initiative. The incentives just aren't there to overcome inter-program & inter-agency territorialism",,
DoctorChaosPhD,@DoctorChaosPhD,2021-02-27T01:06:21.000Z,"Level 5 means as capable as a top human in any conditions, including single lane Himalayan passes, negotiating with sheepherders and police directing traffic directly against signage---requiring full general human level AI. 

L4 without high-res premapping is feasible.",,
David Krae ~ PublicEnemy#246011111,@DavidKrae,2021-02-27T01:01:33.000Z,"There might be a way via Google search tracking, or Facebook analytics, but...

We encounter Timnit Gebru and other such activists involved in language-related AI projects, as well as similar activists working for organizations like Webster's, already skewing things.",,2
Courtney Maguire is on Kobo Plus,@PretentiousAho,2021-02-27T00:49:55.000Z,hahahaha nice. I made fun of my parents for a little while because they have that google home thing and they kept saying please and thank you. the joke's on me when the AI becomes self aware and remembers who the polite ones are,,
Heidi DVM,@Pug2mom15,2021-02-27T00:42:55.000Z,"Companies using google tools exclusively that have ethics departments?
Should we report it?",,
David Krae ~ PublicEnemy#246011111,@DavidKrae,2021-02-27T00:25:15.000Z,"I'm also thinking of the recent fiasco at Google involving Timnit Gebru, who was apparently advocating that Google's language AI be skewed toward social justice re-definitions of words.

That's no longer merely a woke sociology problem, if major search is being manipulated.",,2
Moritz,@moritz_kn,2021-02-27T00:22:28.000Z,For that reason Dota 2 is actually used in AI research. It's an interesting challenge. IIRC they managed to beat humans 1 v 1 but not in teams. Google it if you're interested.,,
EV,@evlead,2021-02-27T00:19:40.000Z,"You can. Devices you use to access, places you visit, check-ins you do, your uber and ola ride expenses, Amazon & flipkart expenses & bigbasket kind of grocery platform. If you have this data about me - I'm sure you can make an estimate. For an AI engine - it's much simpler. ",,1
velcrolog,@velcrolog,2021-02-27T00:02:59.000Z,"I believe the company 
@LoopInsights
 has the technology to solve this problem. They have AI tools to clean up spam on reviews sites (
@amazon
 reviews for example) amongst other powerful things. It would be great if LoopInsights got involved with 
@Google
 and 
@YouTube
 Check them out!",,
TravelingLightonEarth,@vegandiva33,2021-02-26T23:37:10.000Z,Google Earth has yet to show an OI (Olfactorily intelligent) inhabitable location on Google Earth. AI (artificially ignorant) manmade toxins such as fabric softeners make Earth a difficult place even just to be.,,
Lindsey Made It!,@Lindey_Lind,2021-02-26T23:27:09.000Z,I was called by Google's AI voice. It was pretty convincing.,,1
Tom Simonite,@tsimonite,2021-02-26T22:33:28.000Z,Did you refund Google's sponsorship fee or had it not been paid yet?,,
@timnitGebru@dair-community.social on Mastodon,@timnitGebru@dair-community.social on Mastodon,2021-02-26T22:05:21.000Z,The chief diversity officer is the person answering questions about my “departure” & April’s firing. Another Black woman is now the face of responsible AI at Google and betrayed my team’s trust. You can punish with 1 hand and promote the “right” type of Black woman with another.,7,32
Suresh Venkatasubramanian is on mastodon,@geomblog,2021-02-26T22:03:58.000Z,"The initial post was premature -  before the sponsorship list was finalized. As for the final list, we made the call that it was in the best interests of the community to pause the sponsorship relationship with Google while we revise our sponsorship policy for next year.",6,57
Ethan,@MetalWalden,2021-02-26T19:32:27.000Z,"Super mix is all over the place but you're right, the suggested mixes rule. Way better AI than spotify that's for sure. Plus of google owning everything about us haha",,1
Lino's Version,@LinosVersion,2021-02-26T19:25:46.000Z,"AI is increasingly involved in determining everything from credit scores, criminal sentences, insurance & healthcare access. Rather than muffling Gebru, Google inadvertently spotlighted a movement advocating for algorithms that work in service of social justice—not the status quo",,1
Errado,@bot_telo,2021-02-26T19:09:40.000Z,...Google #AI.,,
run,@watIsAgoodUsern,2021-02-26T18:57:45.000Z,Why is there no good tutorial on running ncnn ai programs on google colab,,
Yasam,@yasam,2021-02-26T18:51:36.000Z,"I believe there's just on page optimisation which 
 makes Google understand better and Google over the years developed it's AI so well that it shows the best results to the users. So as Google says just focus your user not just seo.",,2
E. Oliver,@junkion,2021-02-26T18:36:48.000Z,"@google
 get your fucking shit together with a fucking voice to text API AI that you have going on.",,
Paul Tulloch,@ptullochott,2021-02-26T18:32:45.000Z,"Wow- lets hope so! actually wanted to ask that to Meredith this morning at her presentation on AI- given the acts of google and the firing and now the ongoing rise of the ""purists"" and cancel culture extremists- how safe are conferences for women and BIPOC.   So much harrassment",,
Evan McFarland,@Evan_McFarland_,2021-02-26T18:15:56.000Z,"I don't usually complain about Big Tech incidents because they've become unsurprising and miss the big picture, but they're getting harder to ignore.

I'm going to start calling them ""FAAMG's new lows""

This week it's the firing of Google's Ethical AI Founder, Margaret Mitchell.",1,6
Emmanuel Daniel | Social Media Manager,@emmmanueldaniel,2021-02-26T18:10:02.000Z,"“...but it’s likely that Google is the dominant player in the search results that your business or website would want to show up in...”
@Google
 @GoogleAds
 @AdSense
 @adsoftheworld
#DigitalTransformation #DigitalMarketing #onlinemarketing #blogging #contentcreation #AI",4,4
Bhartiya Vaigyanik 2.0,@Vagyanik2_0,2021-02-26T17:48:45.000Z,Trying to type through the voice command. The word is a skewed place. Damn it Google. Damn it AI.,,2
A Human,@OutragedGuy,2021-02-26T17:47:19.000Z,"Google has the best AI for cars, digital assistant etc etc. But you are telling me that 
@Google
 can't freaking have a proper bot for Twitter??

#Google 
@googledocs
 @sundarpichai",,
Kristine (@Schachin on Spoutible too),Kristine (@Schachin on Spoutible too),2021-02-26T17:42:04.000Z,"So Google tolerated the cost of bad dev for content bec of the need for a massive document corpus, but wi/ Natural Language, ML/AI, Passages, & just the sheer number of pages on any topic now --  that is less important. 

I.e They have what they need in terms of docs/intent.

5/",,1
gaby hayek,@HayekGaby,2021-02-26T17:39:19.000Z,"With Universal OVERNIGHT Adoption...You're Sitting On A Treasure TROVE...Literally !
#Entrepreneur #startup #business #success #innovation #5G #TechNews #technology #AI #Retail #investment #Digital #DataScience #DigitalTransformation #ArtificialIntelligence #fintech #life #CX",2,3
gaby hayek,@HayekGaby,2021-02-26T17:34:01.000Z,"That's HOW We'll DO Future Shopping...Regardless Of WHOEVER..!
@amazon
 @JeffBezos
 @Facebook
 @MarkZuckerbelg @Walmartlabs
#Entrepreneur #startup #business #success #innovation #5G #TechNews #technology #AI #Retail #Investment #Digital #DataScience #DigitalTransformation #CX",1,3
Thomas Benham,@nebo333,2021-02-26T17:30:15.000Z,Thx. Took a look. Agree w/ u. I work on build side rather than ethics but ethics has huge role given how ubiquitous AI is / will be. links made in the paper are very broad / general. Fully observed they’d be a huge drag on progress. Google should be at forefront finding right bal,,
"Michael Argényi, MD MPH MSW AAHIVS",@ArgenyiMD,2021-02-26T16:21:32.000Z,"Otter is okay. Most people prefer Google Live Transcribe or the captioning built into Google Slides (only captions the speaker running the slides, though, not any participants).",,
newmethos,@newmethos,2021-02-26T15:56:18.000Z,"I’ll take training Google’s visual processing AI over that impenetrable riddle every day of the week, but I agree, I hate them all",,
LPearson,@LPearsonTX,2021-02-26T15:47:21.000Z,Ha! I was in a bad mood from freezing power outages and low-battery beeps (the google search that led to the captcha) and I was not going to let some stupid AI defeat me ,,4
Jake Hamby,@jhamby,2021-02-26T15:14:16.000Z,"I keep thinking of the women that got fired from the AI ethics group at Google, and there's definitely racism and sexism going on, and also the lack of loyalty to Google's business model, but I think the company also rejects those who don't buy into the ""great man"" worship cult.",1,2
SK SAIFUR RAHAMAN,@MR_Rahaman77,2021-02-26T14:42:21.000Z,"Jodi keu help korte chai.. SK SAIFUR RAHAMAN
STATE BANK OF INDIA
33643206359
SBIN0003083
Ai account a dite paren or PhonePe, google pay no-8478011470",,
griz-lemon,@teemcocoa,2021-02-26T14:40:05.000Z,"I think it’s been a while since we’ve talked AI (maybe a year or so). Would your mobile assistant list still be about the same? I think you had Google on top, Siri and Alexa in the middle, and Bixby rolling around in the mud",,1
Toufi Saliba,@toouufii,2021-02-26T14:30:38.000Z,"I wouldn't fear our existence to be threatened by tech ""on its own""... The biggest threat/fear of AI and what's coming is the human controlling it.. most evil has been done by a human to many.. in fact find out more Google me ""IEEE Toufi""",,1
Ethio Matrix,@EthioMatrix,2021-02-26T14:05:21.000Z,"The AI report completely ignored TPLF in any shape or form indicating that TPLF is dead - no need to accuse a dead evil I guess. btw, who wrote the report ? It looks so amateurish written using electric typewriter & begging us to accept the smoking gun - Google Earth..",,
I am that i am,@usertogo,2021-02-26T14:01:47.000Z,"did you see the video where they asked alexa, google and similar AI 'overlords' about YesUs - the prophets of the holy water - do you know about them or want to know more ?",,
ChannelE2E,@ChannelE2E,2021-02-26T14:00:15.000Z,Google making more changes to its Artificial Intelligence research practices. Changes seek to appease Google employee concerns. Plus: List of #AI #ethics updates involving $GOOG $AMZN $MSFT $IBM $AAPL $FB & more...,3,
Spherestring,@Spherestring,2021-02-26T13:07:33.000Z,"Ahh I see, I don't know enough about the space to know which are accurate and which are propaganda on google. 

No chance, if we turn the internet off where would my bitcoin go? A solar flare might do it for us. 

Google could share their AI and help others optimise data centres.",,
Murasaki Hiroshi,@HiroshiVtuber,2021-02-26T13:02:31.000Z,"Yeah I've a lot. I actually use future ai glasses by Google 
@Artificial1313
  say hi",,1
Spherestring,@Spherestring,2021-02-26T12:59:40.000Z,"wow... That's crazy big, would Google be one of the biggest consumers of energy for this type of thing? Or has their AI optimised their data centres so well that they don't consume anywhere near as much as the rest of the data centres? 

Where did you find your figures?",,
Kevin Walsh,@kevinwalshtv,2021-02-26T11:23:16.000Z,"@Voicify
 Speeding ahead like a bullet train.  Named first ever #Google Accelerator: Voice AI!  The future of searches & internet is voice.  Get onboard!",,
𝚔𝚒𝚛𝚞𝚝𝚒,@kiruti,2021-02-26T10:42:36.000Z,Yup probably my favourite Google app. Google is so good with AI,,
Sixzero,@Sixzero76102653,2021-02-26T08:28:44.000Z,"Why must I google her?Jacob Zuma nd his Friends are busy emotionally Blackmailing us as Black People cause of Our past Sufferings under Apartheid while he was President they were busy with self Enrichment now they want to tell us about WMC, Ai fok Man !",,
hiChris.eth,@xhsu,2021-02-26T08:18:51.000Z,"If the technology is so smart to study my online behavior and well-tailor for my online experience, why can't Google Search block or provide less China-funded search results as the AI pretty much knows that I never click on those results? What's going on Google?",,3
Saha,@NanaOBosompem,2021-02-26T08:05:21.000Z,"One of my favorites. In my opinion, he should change his name from AI to Ayisi or something. AI not helping cos u google his name all u see is Artificial Intelligence. I sent him a DM about it but no response yet",2,1
Josh Bobst,@bobst_josh,2021-02-26T07:53:20.000Z,"Haven't you been paying attention to your own world? Don't you know about Timnit Gebru? Her research showed Google's AI was irreversibly racist, because the people who programmed it had racist ideas, and then Google fired her for publishing her findings. Man, keep up.",,
Dagmar R.,@RDagmar,2021-02-26T07:35:39.000Z,"Don't get mad #Google. I like you, but I don't like your selecction #AI...there are so many interesting small companies in the net, that are worth to be seen.",,1
Koos de la Rey,@KoosdlRey,2021-02-26T06:15:15.000Z,"Combine that with the AI Google, Facebook and Tesla is pushing and we will have a lot of EFF-mentality robots running around, possibly with guns. Imagine.",,1
ARMMAN,@armmanindia,2021-02-26T05:44:11.000Z,"Along with scientific collaboration, the project is being supported with funding from Google Research & 
@Googleorg
. We are currently working towards scaling this to 300,000+ mothers & children in mMitra, with a goal of  reaching 1 million mothers and children.
#mHealth #AI",1,2
Jay,@J_faenboy,2021-02-26T05:02:06.000Z,"The incident with Elsa, Google translate and Tay is a good example of the challenges of relying on AI translation. As language is dynamic, context-dependent, and also dependent on orthography, the irreplaceability of human translators should be front&center, in this Tedtalk I-",1,8
Lauren Frey,@laurencfrey,2021-02-26T03:52:31.000Z,"1/2 I have recently been reading about #AIEthics. But esp. after the firing of 
@timnitGebru
 as Co-Director of 
@Google
’s AI Ethics Team, I've been following it more closely. For those who don’t know about this, would definitely recommend learning abt what’s happening. ",,
Beth Barany,@BethBarany,2021-02-26T03:44:48.000Z,"Ok 
@GoogleChrome
 + 
@Google
 WTF on all the security checks today every time I do a search or open up a new page. Why am I training your AI systems? Are you going to pay me for that?",,
Ghð§† RïÐêr RåÐïð™,@GhostRiderRadio,2021-02-26T03:19:55.000Z,"I asked and critiqued Google search via verbal they couldn't even handle the responses or questions. There's no way in hell I would buy a dot, Alexa or siri to be in my home. They all fail and don't understand context or verbage. AI failure.",,1
CVBruce,@CVBruce,2021-02-26T02:49:16.000Z,Are you going to send Google an invoice for training their clearly deficient AI.,,2
Custom Wetware,@CustomWetware,2021-02-26T02:13:22.000Z,"I think you're good. I know assembly and haven't used it in ages. Swift is pretty nice but unless you have a project that requires it it's a monumental waste of time.

AI will translate everything for us soon anyway (better and easier than google translate).",,1
Ethan,@krob916,2021-02-26T01:46:07.000Z,"Remember when Google or some other big tech (forget who it was) made an AI bot to learn from Twitter and people spammed racist slurs at it and the bot regurgitated it, so they took it down the same day?

Yeah robots are racist if you want them to be",,1
TechSalesLatino,@techsaleslatino,2021-02-26T00:37:49.000Z,"“I Am JusT BuiLt DiffErenTLy”

Nah

-The 6-6 230 lb 10th grader who can dunk like Lebron
-The 15 yr old AI prodigy who has done work for IBM & Google

They are built differently

99.99% of us are not that special",,1
Ali Alkhatib @ali@masto.al2.in,@ali@masto.al2.in,2021-02-25T21:26:06.000Z,"> Google investigated and then fired ethical AI co-lead 
@mmitchell_ai
 for moving electronic files outside the company.

i know Reuters isn't a tech-focused outlet, so we should expect the details to be a little rough, but are we to believe that Margaret was fired for WFH in 2021?",,2
Oluwatobi+,@leavemejor,2021-02-25T21:00:34.000Z,Google gave “irugbin karoti “ ,,
"Love, Theodore Simon",@Theyre_Teddy,2021-02-25T20:45:43.000Z,"Not to be rude, but this is a very easy thing to google yourself. Search “racial bias in ai” and you will find many articles, both journalistic and scholarly, on the topic",,3
Wherd_KMsT,@Wherd_KMsT,2021-02-25T20:26:38.000Z,"It's hard listening to a person of color at the head of Google talking about how great AI is, how it'll be the future but that we just have to get countries to agree not to militarize it. Take a look around, ffs.",,1
Joch,@jochcatastrophe,2021-02-25T20:26:07.000Z,"Bet if you typed “AI racism” into Google you would find a whole bunch of things to read. But also, it doesn’t take data to arrive to the common sense conclusion  that AI will reflect the mindset of its creators. That data does exist, though.",,
VanessaRachelle,@Vanessa_UX,2021-02-25T20:13:11.000Z,"Any opinions on Google Doc's new ""Smart Compose"" feature? I don't know how I feel about this AI completing my sentences. As a society, are we ok with outsourcing so much of our thinking to tech? I already overuse my GPS, I'd like to complete my own sentences...",,
Somewherebetweenoverthereandnothere,@Sykhdellik,2021-02-25T20:11:58.000Z,"I hear you there, but then from the perspective of a worried employee / researcher having their warnings stifled could be very worrying.

Particularly when the company has a finger in billions of people's lives, I believe Google to be a special case.

AI is a new frontier. Warned",,
